article_number,article_header,content
313,Art. 313 :,"1- Dans le plus bref délai possible après ce dépôt, le conser- vateur fait procéder, par l’un des géomètres assermentés attachés à la conservation, au bornage des lots formés. La date de cette opération est portée à la connaissance des personnes, parties, à l’acte à inscrire vingt-quatre (24) heures au moins à l’avance, par une notification en la forme ordinaire ; 2- Le bornage est effectué et constaté dans les formes indiquées par les articles 231 et 232 du présent code ; toutefois, les parties à l’acte y assistent seules, à l’exclusion des propriétaires riverains, à l’égard desquels les limites ont été fixées lors de l’immatriculation. SECTION 3 : DE LA CONSULTATION DES LIVRES FON- CIERS ET DE LA COMMUNICATION DES RENSEIGNEMENTS"
314,Art. 314 :,"Toute personne, en se conformant aux règles ci- après fixées, peut obtenir gratuitement communication des renseignements consignés aux livres fonciers ou renfermés dans les dossiers correspondant aux titres fonciers."
315,Art. 315 :,"A cet effet, les intéressés présentent au conser- vateur de la propriété foncière, une réquisition rédigée en double exemplaire, et tendant à la délivrance, suivant les cas : 1- d’un certificat constatant la concordance d’un titre foncier et de copie dudit titre ; 2- d’un certificat constatant la concordance d’un certificat d’inscription avec les énonciations du titre foncier relatives au même droit réel ; 3- de l’état des droits réels appartenant à une personne déterminée ; 4- de l’état des charges et droits réels grevant un immeuble déterminé ; 5- de la copie d’un acte déposé au dossier d’un immeuble, à l’appui d’une inscription, ou du bordereau analytique qui s’y rapporte. Lesdits certificats, états ou copies, sont établis à la suite de l’une des réquisitions, la seconde reste aux archives de la conservation. DE LA REPUBLIQUE TOGOLAISE 41"
316,Art. 316 :,"Au cas où l’immeuble visé dans une réquisition se trouve grevé d’une hypothèque à inscription différée, dans les conditions des articles 207 et suivant de l’Acte uniforme de l’Organisation pour l’Harmonisation en Afrique du Droit des Affaires (OHADA) portant organisation des sûretés, mention doit en être faite à la suite de l’état ou du certificat requis, avec indication de la durée de validité de l’opposition, si toutefois la nature du renseignement demandé exige cette révélation. CHAPITRE III : DE LA PROTECTION DE LA PROPRIETE FONCIERE DES CITOYENS"
317,Art. 317 :,"Tout acte translatif de propriété foncière ou consti- tutif de droits réels à intervenir entre citoyen togolais et un étranger doit, à peine de nullité, être soumis à l’autorisation préalable de l’autorité publique. La même autorisation préalable est nécessaire à la validité de tout bail, d’une durée supérieure à neuf (09) ans consenti par un citoyen togolais à un étranger. La nullité de l’acte ou du bail peut être poursuivie d’office par le ministère public."
318,Art. 318 :,"Lorsque, après autorisation, un étranger a acquis des droits énumérés à l’article précédent, il ne peut transfé- rer l’un de ces droits à un autre étranger que si ce dernier obtient lui-même une autorisation préalable de l’autorité publique délivrée dans les mêmes formes que la première."
319,Art. 319 :,"Toutefois, des dispositions particulières peuvent dispenser des étrangers de l’autorisation prévue aux articles 317 et 318 ci-dessus."
320,Art. 320 :,"La régularisation d’un acte passé par un étranger sans autorisation préalable est prohibée. L’étranger qui tente de faire régulariser un des actes visés par l’article 317 du présent code est passible des peines prévues aux articles 708 et 709 du présent code. L’agent de l’administration, complice de cet étranger, est passible des peines prévues à l’article 713 du présent code."
321,Art. 321 :,Un décret en conseil des ministres détermine les conditions d’application des présentes dispositions. CHAPITRE IV : DE LA REGULARISATION FONCIERE SECTION 1RE : DU REGIME GENERAL
322,Art. 322 :,La régularisation foncière est l’acte qui met fin : 1- à l’occupation de fait d’une terre domaniale par un particulier ;
323,Art. 323 :,"La régularisation foncière est l’acte par lequel le maire d’une commune fait délivrer à une personne de bonne foi qui occupe une terre domaniale un titre de propriété, dans les conditions édictées par le présent code."
324,Art. 324 :,Le maire est assisté dans la délivrance du titre de propriété par la commission de gestion foncière dont la composition et le fonctionnement sont déterminés par décret en conseil des ministres.
325,Art. 325 :,"Les titres de propriété ne peuvent concerner, en principe, que des terrains préalablement immatriculés au nom de l’Etat et dépendant d’une zone consacrée à l’agricul- ture ou à l’habitat, à l’exclusion des aires protégées ou des zones dites administratives, commerciales, résidentielles ou industrielles, qui obéissent à des règles particulières."
326,Art. 326 :,"Les titres de propriété sont délivrés à tous les citoyens sur simple justification de leur identité, sous conditions que les demandeurs : 1- ne soient pas déjà détenteurs d’un titre foncier dans la même localité, sauf dérogations prévues à l’article 328 du présent code ; 2- justifient d’une emprise permanente et suffisante sur le terrain domanial."
327,Art. 327 :,La superficie maximale de chaque parcelle est fixée par décret en conseil des ministres en fonction des plans d’urbanisme de chaque localité ou de la politique des structures agricoles.
328,Art. 328 :,"En principe, il ne peut être octroyé plus d’une (01) parcelle par demandeur. Exceptionnellement, il peut être octroyé plus d’une (01) parcelle, si la situation de famille du demandeur le justifie, ou en vue de l’installation d’une petite entreprise agricole, commerciale ou artisanale."
329,Art. 329 :,"L’arrêté ou l’acte d’attribution à titre définitif interdit formellement au nouveau propriétaire ou à ses ayants cause de procéder à un morcellement du titre foncier. Cette clause d’indisponibilité sera inscrite au livre foncier par le conservateur, au moment de la mutation au profit du nouveau propriétaire du titre foncier au nom de l’Etat. BLIQUE TOGOLAISE Paragraphe 2 : De l’occupation de fait à l’initiative de l’Etat d’une terre appartenant à un particulier"
330,Art. 330 :,"La régularisation foncière est aussi l’acte par lequel l’Etat rend conforme à la loi une occupation de fait, à son initiative, d’une terre appartenant à un particulier, soit en recourant à une cession forcée, soit en consentant un contrat translatif de propriété ou de jouissance de droit privé."
331,Art. 331 :,"La régularisation foncière ne doit préjudicier ni aux droits des véritables propriétaires, ni aux droits des personnes ou populations installées à l’initiative de l’Etat."
332,Art. 332 :,L’Etat doit en outre réparer le dommage résultant directement de son occupation de fait. SECTION 2 : DES REGIMES PARTICULIERS Paragraphe 1er : Des expropriations de fait
333,Art. 333 :,"Le transfert de propriété d’un bien immobilier, s’il n’y a pas d’accord amiable, ne peut intervenir qu’à la suite de procédure d’expropriation règlementée par les articles 359 et suivants du présent code."
334,Art. 334 :,"Ainsi, il y a expropriation de fait toutes les fois que l’administration prend possession irrégulièrement d’un bien, sans avoir engagé ou fait aboutir la procédure d’expropriation pour cause d’utilité publique, et sans l’accord du propriétaire."
335,Art. 335 :,"Ainsi, il y a voie de fait, toutes les fois que l’admi- nistration prend possession irrégulièrement d’un bien, sans accomplir aucune des formalités de la procédure d’expro- priation pour cause d’utilité publique, et sans l’accord du propriétaire."
336,Art. 336 :,"Dans l’un ou l’autre cas, le propriétaire spolié peut alors saisir les tribunaux judiciaires de droit commun pour obtenir la restitution de son bien et réparation du préjudice subi. Il peut poursuivre la démolition de l’ouvrage public érigé sur son fonds."
337,Art. 337 :,"Le juge saisi peut ordonner la démolition de l’ouvrage public érigé en violation du droit de propriété lorsqu’aucune régularisation appropriée n’est possible ou lorsque les inconvénients de son implantation irrégulière l’emportent sur les avantages pour l’intérêt général à le maintenir en l’état. Lorsqu’une régularisation appropriée est possible, l’adminis- tration doit engager une nouvelle procédure d’expropriation pour cause d’utilité publique. JOURNAL OFFICIEL Paragraphe 2 : Des colonisations agricoles planifiées"
338,Art. 338 :,"Il y a colonisation agricole d’origine planifiée lorsque l’administration fait installer une population dépla- cée ou des agriculteurs, sur un périmètre délimité ou dans une zone à potentiel agricole."
339,Art. 339 :,Le périmètre délimité ou la zone à potentiel agri- cole peut être objet d’un bail emphytéotique. A. De la colonisation d’un périmètre objet d’un bail emphytéotique
340,Art. 340 :,Les rapports entre l’administration et le bailleur sont soumis au régime du bail emphytéotique.
341,Art. 341 :,"Sauf stipulation contraire, à l’initiative de l’admi- nistration, le territoire ou le périmètre colonisé doit être immatriculé au nom du bailleur."
342,Art. 342 :,"A l’expiration du bail, le bailleur ou son successeur recouvre l’exercice du droit de propriété. Toutefois, le titulaire de ce droit ne sera remis en posses- sion des terres du périmètre qu’après paiement effectif à l’administration d’une indemnité égale à la plus-value apportée au fonds."
343,Art. 343 :,Les parties s’engagent à négocier à tout moment une modification de leur convention pour le cas où il advien- drait que par l’effet des circonstances : 1- l’équilibre des prestations réciproques fut perturbé au point que le contrat perde tout intérêt pour l’une d’elles ; 2- ou l’application des clauses initiales fut de nature à causer un trouble grave à l’ordre public ; 3- toute clause contraire est nulle.
344,Art. 344 :,Toutes les colonisations d’un périmètre objet d’un bail emphytéotique doivent être régularisées conformément aux dispositions ci-dessus. B. De la colonisation d’une zone réputée à l’origine terre vacante et sans maître
345,Art. 345 :,"Préalablement à toute installation de colons, l’Etat doit avoir délimité la zone réputée à l’origine terre vacante et sans maître, sans préjudicier aux droits fonciers des propriétaires limitrophes."
346,Art. 346 :,La zone réputée à l’origine terre vacante et sans maître est propriété de l’Etat et immatriculée à son nom. DE LA REPUBLIQUE TOGOLAISE 43
347,Art. 347 :,Toutes les colonisations d’une zone réputée à l’origine terre vacante et sans maître doivent être régulari- sées conformément aux dispositions ci-dessus. Paragraphe 3 : Des lotissements clandestins ou de fait
348,Art. 348 :,Les dispositions de la présente section ne s’appliquent qu’autant qu’elles sont compatibles avec les prescriptions d’urbanisme.
349,Art. 349 :,"Le lotissement clandestin ou lotissement de fait est tout lotissement d’un immeuble muni d’un titre foncier ou non, effectué sans les autorisations et formalités préalables prévues par les textes en vigueur. Un tel lotissement ne peut en aucun cas préjudicier au droit de l’Etat à une réserve administrative et à la voirie."
350,Art. 350 :,"Tout propriétaire de bonne foi d’un lot issu d’un lotissement clandestin ou de fait est redevable à l’Etat de 50 % de la surface dudit lot,sans préjudice des éventuelles sanctions pénales prévues par les textes en vigueur à l’encontre du lotisseur clandestin ou de fait."
351,Art. 351:,"Lorsqu’il est impossible de transférer en propriété à l’Etat les 50 % de la surface du lot, le propriétaire de bonne foi est obligé de lui payer l’équivalent en argent. Paragraphe 4 : De l’occupation irrégulière du domaine foncier national"
352,Art. 352 :,Pour l’application de la présente section : 1- l’article 711 du Code pénal du Togo est inapplicable à l’exploitant sans titre du domaine foncier national éligible à la procédure de régularisation foncière ; 2- l’exploitant sans titre d’une parcelle du domaine foncier national est assimilé à un constructeur de mauvaise foi sur le terrain d’autrui.
353,Art. 353 :,"Est illicite l’occupation sans titre d’une terre du domaine foncier national réglementé par les articles 560 à 563 du présent code. Néanmoins, est éligible à la procédure de régularisation fon- cière tout exploitant sans titre, membre d’une communauté de résidence ou d’une communauté riveraine du domaine foncier national, justifiant d’une emprise consistante, permanente et utile sur une parcelle dudit domaine."
354,Art. 354 :,La demande de régularisation doit être transmise par le maire du lieu de situation de l’immeuble exploité au service chargé des domaines.
355,Article 355 :,"Le service chargé des domaines contrôle la validité de la demande de régularisation, en faisant procé- der, au besoin, à des enquêtes. Elle doit par ailleurs requérir l’avis du service chargé de la législation agro-foncière."
356,Article 356 :,"Toute décision rendue dans le cadre de la procédure de régularisation doit être motivée, sous peine de nullité."
357,Article 357 :,"Au terme de la procédure de régularisation foncière, l’exploitant sans titre devient propriétaire du fonds qu’il a mis en valeur dans les conditions précisées par les articles 326 à 328 du présent code."
358,Article 358 :,"Le service chargé des domaines doit faire muter au profit de l’exploitant sans titre, le titre foncier pré- alablement créé au nom de l’Etat et à son initiative. SOUS-TITRE VI : DES ATTEINTES AU DROIT DE PROPRIETE CHAPITRE Ier : DES ATTEINTES DANS L’INTERET GENERAL SECTION 1ère : DE L’EXPROPRIATION POUR CAUSE D’UTILITE PUBLIQUE Paragraphe 1er : Des dispositions générales"
359,Article 359 :,"L’expropriation pour cause d’utilité publique est prononcée à défaut d’accord amiable, par les tribunaux, moyennant le paiement d’une juste et préalable indemnité."
360,Article 360:,"L’expropriation d’immeubles, en tout ou par- tie, ou de droits réels immobiliers, ne peut être prononcée qu’autant que l’utilité publique en a été déclarée et constatée dans les formes prescrites par le présent code. A défaut d’accord amiable, le transfert de propriété et la fixation du montant de l’indemnité qui la conditionnent relève de la compétence du juge."
361,Article 361:,"Le droit d’expropriation est ouvert à l’Etat, aux collectivités locales, aux personnes morales de droit public ainsi qu’aux personnes morales ou physiques de droit privé auxquelles la puissance publique délègue des droits en vue d’entreprendre des travaux ou des opérations déclarés d’utilité publique. Dans ce dernier cas, les droits de ces personnes morales ou physiques de droit privé sont précisés par décret en conseil des ministres. BLIQUE TOGOLAISE Paragraphe 2 : Des enquêtes publiques"
362,Art. 362 :,"L’expropriation d’immeuble en tout ou partie, ou de droits réels immobiliers, ne peut être prononcée qu’autant qu’elle aura été précédée d’une déclaration d’utilité publique intervenue à la suite d’une enquête publique. Les modalités de l’enquête publique préalable sont définies par décret en conseil des ministres."
363,Art. 363 :,"Par dérogation à l’article 362 et selon une pro- cédure simplifiée, certaines opérations d’intérêt général ou présentant un caractère d’urgence notamment lié à la résorption de l’habitat insalubre ou pour des immeubles menaçant ruine, mettant en péril la sécurité de la popula- tion, sont dispensées de l’enquête publique préalable de droit commun. Dans de telles hypothèses, le dépôt d’un dossier simplifié décrivant l’immeuble à exproprier précède la déclaration d’utilité publique. Les modalités de dépôt de ce dossier simplifié sont préci- sées par un décret en conseil des ministres. Paragraphe 3 : De la déclaration d’utilité publique"
364,Art. 364 :,L’utilité publique des opérations ou travaux est expressément déclarée par un acte administratif. Un décret en conseil des ministres détermine les différentes catégories d’actes administratifs pouvant déclarer l’utilité publique d’un bien en fonction de la nature de l’opération d’expropriation projetée. L’acte déclarant l’utilité publique est accompagné d’un document qui expose les motifs justifiant le caractère d’utilité publique de l’opération d’expropriation.
365,Art. 365 :,L’acte déclaratif d’utilité publique désigne la zone faisant l’objet de la procédure d’expropriation et précise le délai dans lequel l’expropriation devra être réalisée.
366,Art. 366 :,"L’acte déclaratif d’utilité publique peut designer immédiatement la liste des propriétés auxquelles l’expro- priation est applicable. A défaut, ces propriétés doivent être désignées par un acte de cessibilité en vertu du présent article. Cet acte de cessibilité intervient, au plus tard, dans un délai de trois (03) ans à compter de la date de publication de l’acte déclaratif d’utilité publique. A défaut, l’utilité publique devra à nouveau être déclarée. JOURNAL OFFICIEL"
367,Art. 367 :,"Si l’acte déclaratif d’utilité publique désigne la liste des propriétés faisant l’objet d’une expropriation, il a valeur d’acte de cessibilité tel que défini dans la présente loi. Paragraphe 4 : De l’acte de cessibilité"
368,Art. 368 :,"L’acte de cessibilité est une décision individuelle ou collective qui désigne par leur nom les personnes concer- nées par l’expropriation. L’acte de cessibilité est précédé d’une enquête parcellaire. Cette enquête est distincte de l’enquête publique préalable à la déclaration d’utilité publique. A cet effet, un projet assorti d’un plan indiquant les propriétés atteintes, est déposé au bureau de la commune, de la préfecture, du tribunal et de la conservation de la propriété foncière concernée où les intéressés peuvent en prendre connaissance et présenter leurs observations pendant une durée d’un (01) mois à compter de l’avis de dépôt du projet. Les modalités de l’enquête parcellaire sont définies par décret en conseil des ministres."
369,Art. 369 :,L’acte de cessibilité fait l’objet : 1- d’une publication au
370,Art. 370 :,"En vue de la fixation des indemnités et à compter de sa publication, l’acte de cessibilité est notifié sans délai aux propriétaires intéressés, occupants et usagers notoires. Dans un délai d’un (01) mois à compter de la notification, les propriétaires intéressés, sont tenus de faire connaître à l’expropriant, les fermiers, locataires, ou détenteurs de droit réel sur leurs immeubles, faute de quoi, ils seront seuls chargés envers ces derniers des indemnités que ceux-ci pourraient réclamer. Tous autres intéressés sont tenus de se faire connaître à l’expropriant, à défaut de quoi, ils seront déchus du droit à l’indemnité."
371,Art. 371 :,"Dans un délai de trois (03) mois après la notifica- tion de l’acte de cessibilité, l’expropriant notifie par arrêté aux intéressés le montant de l’indemnité proposé et les DE LA REPUBLIQUE TOGOLAISE 45 invite à faire connaître l’indemnité demandée. Cet arrêté vaut convocation devant la commission d’expropriation (COMEX) créée par la loi n° 2014- 014 du 22 octobre 2014 pour fixation à l’amiable du montant de l’indemnité."
372,Art. 372 :,"La COMEX constate l’accord des parties sur le montant de l’indemnité. En cas de désaccord, elle tente de trouver, par tout moyen de conciliation, un accord sur le montant de l’indemnité. Un procès-verbal de cet accord est dressé et signé par le président et chacun des membres de la commission ainsi que par les parties. Les parties peuvent s’entendre sur une indemnisation par voie d’échange d’un immeuble appartenant à l’autorité expropriante, de valeur équivalente. A la requête de la partie la plus diligente, le tribunal de pre- mière instance prononce l’homologation de l’accord amiable en s’assurant de la réalité et de l’intégrité de l’échange des consentements des parties. Paragraphe 6 : De l’absence d’accord amiable sur la fixation du montant de l’indemnité"
373,Art. 373 :,"A défaut d’accord amiable, le tribunal de première instance du lieu de situation de l’immeuble est seul com- pétent pour statuer sur la date de transfert de propriété et pour fixer le montant de l’indemnité. Le tribunal de première instance est saisi par la partie la plus diligente par voie d’assignation."
374,Art. 374 :,"L’indemnité d’expropriation est fixée par voie judiciaire conformément aux règles ci-après exposées : 1- l’indemnité d’expropriation ne doit comprendre que le dommage actuel et certain directement causé par l’expro- priation ; elle ne peut s’étendre à un dommage incertain éventuel ou indirect ; 2- elle est fixée d’après la valeur de l’immeuble au jour de la décision prononçant l’expropriation sans qu’il puisse être tenu compte, pour la détermination de cette valeur, des constructions, plantations et améliorations faites, sans l’accord de l’expropriant, depuis la publication de l’acte déclaratif de l’utilité publique ; 3- l’indemnité ainsi calculée ne peut dépasser la valeur de l’immeuble au jour de la publication de l’acte de cessibilité ou de la notification de l’acte déclaratif d’utilité publique désignant les propriétés frappées d’expropriation. Il n’est pas tenu compte dans la détermination de cette valeur des"
375,Art. 375 :,"Une expertise devra être ordonnée si elle est demandée par une des parties. Elle doit être conduite par trois (03) experts agréés désignés par le tribunal de pre- mière instance, à moins que les parties soient d’accord sur le choix d’un expert unique."
376,Art. 376 :,"Le tribunal de première instance accorde, s’il y a lieu, et dans les mêmes formes, des indemnités distinctes aux fermiers, locataires ou détenteurs de droits réels sur leurs immeubles ainsi qu’à tout autre intéressé qui s’est fait connaître à l’expropriant conformément à l’article 370 du présent code. Dans le cas où il existe le droit d’usufruit, d’usage, d’habi- tation ou autres droits analogues ou de même nature, une seule indemnité est fixée par le tribunal de première instance eu égard à la valeur totale de l’immeuble."
377,Art. 377 :,Le propriétaire de l’immeuble frappé en par- tie d’expropriation peut exiger de la personne publique expropriante l’acquisition totale par une requête adressée à la juridiction administrative compétente et notifiée à la personne publique concernée.
378,Art. 378 :,"Si les immeubles expropriés n’ont pas reçu pendant un délai de dix (10) ans à compter de la prise de possession de l’immeuble par l’expropriant, la destination prévue ou ont cessé de recevoir cette destination, les anciens propriétaires ou leurs ayants droit peuvent en demander la rétrocession à moins que ne soit requise une nouvelle déclaration d’utilité publique."
379,Art. 379 :,Les décisions rendues par le tribunal de première instance sont susceptibles d’appel. Le jugement de première instance est exécutoire par provision nonobstant appel et moyennant consignation du montant de l’indemnité déterminé par le tribunal.
380,Art. 380 :,"Les parties sont tenues de faire élection de domi- cile, au début de la procédure, au siège du tribunal de la situation des immeubles. BLIQUE TOGOLAISE"
381,Art. 381 :,"Sauf dérogation, les règles de compétence et de procédure applicables en matière d’expropriation, sont celles du droit commun. Paragraphe 7 : Du paiement de l’indemnité et de l’entrée en possession"
382,Art. 382 :,"Dès la signature du procès-verbal d’accord amiable, entre la commission d’expropriation, l’exproprié et l’autorité expropriante, ou dès le jugement fixant le montant de l’indemnité d’expropriation en denier ou statuant sur l’échange proposé par l’autorité expropriante, l’indemnité doit être versée à l’intéressé."
