article_number,article_header,content
449,Art. 449 :,Le droit d’usage et d’habitation s’établit et se perd de la même manière que l’usufruit. Il ne peut être ni cédé ni loué. Il doit être exercé par son titulaire dans le respect de la destination normale du bien.
450,Art. 450 :,Le bénéficiaire du droit d’usage et d’habitation est soumis aux obligations imposées à l’usufruitier par les articles 437 à 441 du présent code.
451,Art. 451 :,"Si l’usager utilise la totalité du fonds, il est tenu des dépenses d’entretien et plus généralement des dépenses périodiques que l’article 429 du présent code met à la charge de l’usufruitier. S’il n’utilise qu’une partie du fonds, il y contribue au prorata de ce dont il jouit. SOUS-TITRE III : DU DROIT DE SUPERFICIE"
452,Art. 452 :,"Le droit de superficie consiste dans le fait de posséder des constructions, ouvrages ou plantations sur un fonds appartenant à autrui. Le titulaire peut grever de servitudes les biens qui font l’objet de son droit, mais seulement dans la limite qui lui est imposée pour l’exercice de ce droit."
453,Art. 453 :,"Sont dispensées de la publicité, les servitudes dérivant de la situation naturelle des lieux ou des obligations imposées par la loi, à l’exception, cependant, de la servitude de passage pour cause d’enclave, dont l’assiette doit être exactement déterminée soit au moment de l’immatriculation du fonds grevé, soit lors de la création de la servitude si celle-ci est postérieure à l’immatriculation."
454,Art. 454:,"La faculté accordée aux cohéritiers ou à l’un d’entre eux d’écarter du partage toute personne non suc- cessible à laquelle un cohéritier aurait cédé son droit à la succession appartient également au superficiaire pour l’acquisition du sol et au propriétaire du sol, pour compter du jour où la vente a été rendue publique. JOURNAL OFFICIEL SOUS-TITRE IV : DES SERVITUDES OU SERVICES FONCIERS CHAPITRE IER : DES DISPOSITIONS GENERALES SECTION 1RE : DE LA DEFINITION"
455,Art. 455 :,"La servitude est une charge réelle grevant un fonds pour l’usage et l’utilité d’un fonds appartenant à un autre propriétaire. Elle n’établit ni prééminence d’une propriété sur l’autre ni obligations personnelles au profit ou à la charge des pro- priétaires, mais seulement des rapports entre fonds servant et fonds dominant et des services qui leur sont attachés. SECTION 2 : DE L’ETABLISSEMENT DES SERVITUDES"
456,Art. 456 :,Toutes les servitudes peuvent s’établir par convention.
457,Art. 457 :,Les servitudes établies par la loi obéissent aux règles qui les instituent.
458,Art. 458 :,Les servitudes qui se manifestent par des ou- vrages extérieurs ou par une activité humaine apparente et renouvelée peuvent s’acquérir par la possession dans les conditions des articles 418 et 422 du présent code.
459,Art. 459 :,"Les servitudes peuvent aussi s’établir par des- tination du propriétaire entre fonds issus d’une division, à défaut de stipulation contraire de l’acte de division. Elles résultent, dans ce cas, du maintien d’ouvrages ou d’amé- nagements extérieurs réalisés par le propriétaire avant la division du fonds. SECTION 3 : DE L’EXERCICE DES SERVITUDES"
460,Art. 460 :,La servitude comprend tout ce qui est nécessaire pour en user.
461,Art. 461 :,"Le propriétaire du fonds dominant réalise sur le fonds servant les ouvrages éventuellement nécessaires à l’exercice ou au maintien de la servitude et en supporte le coût, sauf la convention de l’article 462."
462,Art. 462 :,"Lorsque le propriétaire du fonds servant est tenu par la convention de faire ou de laisser faire à ses frais des ouvrages nécessaires à l’exercice et au maintien de la servitude, il peut toujours s’en affranchir en abandonnant au propriétaire du fonds dominant, à sa convenance, soit le fonds servant soit le terrain d’assiette de la servitude. DE LA REPUBLIQUE TOGOLAISE 53"
463,Art. 463 :,"La servitude est indivisible. En cas de division du fonds servant ou du fonds dominant, la servitude continue à être exercée activement et passi- vement selon les mêmes modalités sur la totalité du fonds servant et au profit de la totalité du fonds dominant."
464,Art. 464 :,"Le propriétaire du fonds servant ne peut rien faire qui tende à diminuer l’usage de la servitude ou à le rendre plus incommode. Ainsi, il ne peut modifier l’état des lieux ni les modalités d’exercice de la servitude. Cependant, si des conditions nouvelles de fait ou de droit rendent l’exercice de la servitude plus onéreuse pour le fonds servant ou en empêchent l’usage normal, le propriétaire du fonds servant peut offrir une autre assiette au propriétaire du fonds dominant. En cas de refus, le juge détermine l’assiette la plus appro- priée eu égard aux intérêts en présence."
465,Art. 465 :,Le propriétaire du fonds dominant ne peut user de la servitude que suivant son titre et sans aggraver la situation du fonds servant.
466,Art. 466 :,La servitude s’éteint par le non-usage pendant trente (30) ans. Le délai de trente (30) ans commence à courir à compter du jour où l’on a cessé d’en jouir pour les servitudes qui s’exercent par une activité humaine appa- rente et renouvelée et du jour où il a été fait un acte contraire pour les autres servitudes.
467,Art. 467 :,"Si l’exercice d’une servitude est devenu défini- tivement impossible, le propriétaire du fonds servant peut à tout moment en faire constater l’extinction par le juge."
468,Art. 468 :,Toute servitude s’éteint par la réunion du fonds dominant et du fonds servant dans le même patrimoine.
469,Art. 469 :,"Si le fonds dominant est en indivision, la jouis- sance de l’un des indivisaires empêche la prescription à l’égard de tous."
470,Art. 470 :,La suspension de la prescription à l’encontre d’un des indivisaires profite à tous.
471,Art. 471 :,"Les modalités d’exercice de la servitude s’éta- blissent, à défaut de convention contraire, par un usage trentenaire."
472,Art. 472 :,"Est enclavé, un fonds qui n’a pas une issue suf- fisante sur la voie publique pour permettre son utilisation ou son exploitation économique normale."
473,Art. 473 :,"Le propriétaire d’un fonds enclavé peut réclamer en justice un passage suffisant sur les fonds de ses voisins, à charge d’indemniser ces derniers du préjudice subi, à moins que l’état d’enclave n’ait été volontairement constitué."
474,Art. 474 :,"Sous réserve des dispositions de l’article 473 du présent code, le passage doit être pris du côté et sur le ou les fonds où le trajet du fonds enclavé à la voie publique est le plus court, à moins qu’un autre trajet ne soit moins dommageable."
475,Art. 475 :,"Si l’enclave résulte de la division d’un fonds par suite d’une convention, le passage ne peut être demandé, dans les trente (30) ans suivant la division, que sur les terrains qui sont issus de cette division. Toutefois, le propriétaire du fonds enclavé peut, dans le cas où aucun passage suffisant ne pourrait être établi sur les fonds divisés, intenter l’action prévue à l’article 473 du présent code."
476,Art. 476 :,L’assiette et les modalités de passage pour cause d’enclave sont déterminées par trente (30) ans d’usage continu.
477,Art. 477 :,"L’action en indemnité du propriétaire du fonds servant se prescrit par trente (30) ans, mais le passage demeure malgré cette prescription."
478,Art. 478:,"En cas de cessation de l’enclave, le propriétaire du fonds assujetti peut à tout moment demander sa sup- pression. A défaut d’accord amiable, cette disparition est constatée par le juge."
479,Art. 479 :,L’entretien du passage obéit aux règles de l’article 461 du présent code. SOUS-TITRE V : DES HYPOTHEQUES
480,Art. 480 :,"L’hypothèque est l’affectation d’un immeuble déterminé ou déterminable appartenant au constituant en garantie d’une ou plusieurs créances, présentes ou futures à condition qu’elles soient déterminées ou déterminables. Elle est légale, conventionnelle ou judiciaire. Elle est régie par les articles 195 et suivants de l’Acte uni- forme de l’Organisation pour l’Harmonisation en Afrique du Droit des Affaires (OHADA) portant organisation des sûretés. BLIQUE TOGOLAISE SOUS-TITRE VI : DES PRIVILEGES"
481,Art. 481 :,"Les privilèges sont régis par les articles 179 et suivants de l’Acte uniforme de l’Organisation pour l’Harmonisation en Afrique du Droit des Affaires (OHADA) portant organisation des sûretés. Ils confèrent un droit de préférence exercé par leurs titulaires conformément aux dispositions des articles 225 et 226 dudit Acte uniforme. SOUS-TITRE VII : DES DROITS REELS CONFERES PAR DES BAUX : BAIL EMPHYTEOTIQUE, BAIL A CONSTRUCTION, BAIL A PLANTATION CHAPITRE IER : DU BAIL EMPHYTEOTIQUE"
482,Art. 482 :,"Le bail emphytéotique est une convention par laquelle un propriétaire loue des biens immobiliers (terrains, bâtiments d’exploitation, bâtiments d’habitations) pour une durée minimale de dix-huit (18) ans et maximale de quatre- vingt-dix-neuf (99) ans, pour une somme modique. Ce type de bail n’est pas soumis au statut du fermage. Le bail emphytéotique doit être consenti dans les mêmes conditions et formes que la vente immobilière, sous peine de nullité."
483,Art. 483 :,"Le bail emphytéotique ne peut être valablement consenti que par ceux qui ont le droit d’aliéner, et sous les mêmes conditions, comme dans les mêmes formes. Les immeubles appartenant à des mineurs ou à des majeurs sous tutelle peuvent être donnés à bail emphytéotique en vertu d’une délibération du conseil de famille. Lorsque les époux restent soumis au régime dotal, le mari peut donner à bail emphytéotique les immeubles dotaux avec le consentement de la femme et l’autorisation de justice."
484,Art. 484 :,La preuve du contrat d’emphytéose s’établit par acte notarié.
485,Art. 485 :,"A défaut de conventions contraires, le contrat d’emphytéose est régi par les dispositions des articles 486 à 493 ci-après."
486,Art. 486 :,Le preneur ne peut demander la réduction de la redevance pour cause de perte partielle du fonds ni pour cause de stérilité ou de privation de toute récolte à la suite de cas fortuits.
487,Art. 487 :,"A défaut de paiement de deux (02) années consécutives, le bailleur est autorisé, après une sommation restée sans effet, à faire prononcer en justice la résolution de l’emphytéose. JOURNAL OFFICIEL La résolution peut également être demandée par le bail- leur en cas d’inexécution des conditions du contrat ou si le preneur a commis sur le fonds des détériorations graves. Néanmoins, les tribunaux peuvent accorder un délai suivant les circonstances."
488,Art. 488 :,"Le preneur ne peut se libérer de la redevance, ni se soustraire à l’exécution des conditions du bail emphy- téotique en délaissant le fonds."
489,Art. 489 :,"Le preneur ne peut opérer dans le fonds aucun changement qui en diminue la valeur. Si le preneur fait des améliorations ou des constructions qui augmentent la valeur du fonds, il ne peut les détruire ni réclamer à cet égard aucune indemnité."
490,Art. 490 :,"Le preneur est tenu de toutes les contributions et charges de l’héritage. En ce qui concerne les constructions existant au moment du bail et celles qui auront été élevées en exécution de la convention, il est tenu des réparations de toute nature, mais il n’est pas obligé de reconstruire les bâtiments, s’il prouve qu’ils ont été détruits par cas fortuit, par force majeure ou qu’ils ont péri par le vice de la construction antérieure au bail. Il répond de l’incendie, à moins qu’il ne prouve que l’incen- die est arrivé par cas fortuit ou force majeure, ou par vice de construction, ou que le feu a été communiqué par une maison voisine."
491,Art. 491 :,"L’emphytéote peut acquérir au profit du fonds des servitudes actives, et les grever, par titres, de servitudes passives, pour un temps qui n’excédera pas la durée du bail à charge d’avertir le propriétaire."
492,Art. 492 :,L’emphytéote profite du droit d’accession pendant la durée de l’emphytéose.
493,Art. 493 :,"Le preneur a seul le droit de chasse et de pêche et exerce à l’égard des mines, carrières et tourbières tous les droits de l’usufruitier."
494,Art. 494 :,"Ainsi qu’il est mentionné dans le Code général des impôts, l’acte constitutif de l’emphytéose est assujetti au droit proportionnel perçu à l’occasion de services réali- sés par le service des domaines et de la conservation de la propriété foncière et aux droits d’enregistrement aux taux prévus pour le bail. Les mutations de toute nature ayant pour objet, soit le droit du bailleur, soit le droit du preneur, sont soumises DE LA REPUBLIQUE TOGOLAISE 55 aux dispositions du Code général des impôts concernant les transmissions de propriété d’immeubles. Le droit est liquidé sur la valeur vénale déterminée par une déclaration estimative des parties. CHAPITRE II : DU BAIL A CONSTRUCTION"
495,Art. 495 :,"Le bail à construction est celui par lequel le pre- neur s’engage, à titre principal, à édifier des constructions sur le terrain du bailleur et à les conserver en bon état d’entretien pendant toute la durée du bail. L’obligation de construire mise à la charge du preneur constitue une obligation de résultat. Le bail est consenti pour une période ne pouvant excéder quarante (40) ans. Il ne peut être prorogé par tacite reconduction."
496,Art. 496 :,"Le bail à construction, sous réserve de dispositions spéciales, confère au preneur un droit réel immobilier susceptible d’hypothèque de même que les constructions édifiées sur le terrain loué ; il peut être saisi dans les formes prescrites pour la saisie immobilière. Il est cessible et peut être apporté en société, en tout ou en partie."
497,Art. 497 :,Le preneur peut consentir des servitudes passives indispensables à l’achèvement des constructions.
498,Art. 498 :,"Le bail à construction ne peut être consenti vala- blement que par les personnes qui ont le droit de disposer et d’aliéner, sous les mêmes conditions et dans les mêmes formes."
499,Art. 499 :,"Le bailleur devient propriétaire, en fin de bail, des constructions édifiées par le preneur et profite des améliorations, s’il n’en est autrement convenu."
500,Art. 500 :,Le preneur est tenu de maintenir les constructions en bon état d’entretien et de réparation de toute nature. Il répond de l’incendie des bâtiments existants et de ceux qu’il a édifiés. Il peut les démolir en vue de les reconstruire.
501,Art. 501 :,"Le prix du bail peut consister en la remise au bailleur, à des dates et conditions convenues, de tout ou partie d’immeubles et de fractions d’immeubles."
502,Art. 502 :,Les terrains du domaine privé de l’Etat et des autres personnes morales de droit public peuvent être donnés à bail à construction.
503,Art. 503 :,"Le bail à plantation est celui par lequel le preneur s’engage, à titre principal à procéder à des plantations d’arbres sur le terrain du bailleur et à entretenir le terrain et les arbres pendant toute la durée du bail."
504,Art. 504 :,Les règles qui régissent le droit du bail à construction énoncées ci-dessus s’appliquent au bail à plantation dans la mesure où elles ne sont pas incompa- tibles avec la nature de ce bail. TITRE VI : DU DOMAINE IMMOBILIER DE L’ETAT ET DES COLLECTIVITES TERRITORIALES SOUS-TITRE I : DU DOMAINE PUBLIC DE L’ETAT ET DES COLLECTIVITES TERRITORIALES CHAPITRE IER: DE LA COMPOSITION DU DOMAINE PUBLIC IMMOBILIER DE L’ETAT ET DES COLLECTIVITES TERRITORIALES
505,Art. 505 :,"Le domaine public comprend tous les immeubles qui, par nature ou par destination, sont à la disposition du public et qui appartiennent : 1- soit à l’Etat ; ils constituent alors le domaine public de l’Etat ; 2- soit aux établissements publics, collectivités publiques territoriales secondaires et services publics industriels ou commerciaux ; ils constituent alors les domaines publics respectifs de ces établissements, collectivités ou services."
506,Art. 506 :,Le domaine public peut être naturel ou artificiel.
507,Art. 507 :,"Font partie du domaine public naturel, le domaine public maritime et le domaine public fluvial. Le domaine public maritime se compose de : 1- la mer territoriale, son sol et son sous-sol s’étendant à douze (12) milles marins à partir de la laisse de basse mer ainsi que les espaces s’étendant entre la laisse de basse mer et le rivage ; 2- les parties du rivage de la mer alternativement couvertes et découvertes par les eaux de la mer ; 3- une zone supplémentaire de cent (100) mètres à partir de la laisse de haute mer ; 4- les lais et relais de la mer. BLIQUE TOGOLAISE Le domaine public fluvial comprend : 1- les cours d’eau, leurs lits et francs bords dans les limites déterminées par les hauteurs des eaux coulant à pleins bords avant débordement ainsi qu’une zone de trente (30) mètres de large à partir de ces limites ; 2- les sources et les cours d’eau non navigables ni flottables dans les limites déterminées par la hauteur des eaux coulant à pleins bords avant débordements ; les riverains de ces cours d’eau sont soumis à une servitude de passage sur une zone large de dix (10) mètres sur chaque rive ; 3- les lacs, étangs, lagunes dans les limites déterminées par les niveaux des plus hautes eaux avant débordement avec une zone de protection de cent (100) mètres de largeur de ces limites sur chaque rive extérieure et sur chacun des bords des îles."
508,Art. 508 :,"Font partie du domaine public artificiel : 1- les ports maritimes militaires ou de commerce avec dépendantes nécessaires (digues, jetées, bassins, écluses, etc…) ainsi que les ports fluviaux, les canaux de navigation et leurs chemins de halage, les aqueducs exécutés dans un but d’utilité publique, ainsi que les dépendances de ces ouvrages ; 2- les chemins de fer et leurs emprises ; les routes et voies de communication de toutes natures avec leurs emprises telles qu’elles sont fixées par décret en conseil des ministres ; 3- les lignes et postes télégraphiques et leurs dépendances ; 4- les aérodromes, aéroports, aérogares, et leurs dépen- dances avec les emprises et servitudes telles qu’elles sont fixées par les règlements internationaux et par décret en conseil des ministres ; 5- les ouvrages exécutés dans un but d’utilité publique pour l’utilisation des eaux et la fourniture de l’énergie ; 6- généralement les biens de toute nature ayant vocation à l’usage direct du public, dans un but de circulation des personnes ou des biens ; 7- le domaine public de défense qui comprend tous les ouvrages de défense terrestre, maritime et aérienne de la nation ; 8- tout autre équipement qui grève le domaine de l’Etat. Le domaine public comprend également les monuments publics, les halles, les marchés, les cimetières délimités et généralement tous les biens non susceptibles d’appro- priation privée. JOURNAL OFFICIEL"
509,Art. 509 :,"En cas de doute ou de contestation sur les limites du domaine public naturel, il est statué par décret en conseil des ministres sur proposition du ministre ayant le service de ces terres dans ses attributions."
510,Art. 510 :,Les immeubles destinés à faire partie du do- maine public artificiel sont définis par décrets en conseil des ministres ; ces décrets constituent des actes de déclarations d’utilité publique permettant d’engager la procédure d’expropriation.
511,Art. 511 :,"Le domaine public est inaliénable, imprescriptible et insaisissable."
512,Art. 512 :,Les portions du domaine public naturel ou artificiel qui sont reconnues sans utilité peuvent être désaffectées par décret en conseil des ministres. Les immeubles ainsi déclassés accroissent le domaine privé.
513,Art. 513 :,"Le domaine public grève les fonds riverains de servitudes d’utilité publique dont la nature et l’importance sont déterminées d’après la destination assignée aux ter- rains concernés. Aucune indemnité n’est due aux propriétaires en raison de ces servitudes. Toutefois, s’il est nécessaire, pour leur plein exercice, de procéder à la destruction de bâtiments ou de plantations, il est dû aux propriétaires intéressés une indemnité fixée comme en matière d’expropriation pour cause d’utilité publique."
514,Art. 514 :,"La police, la conservation et l’utilisation du domaine public naturel et artificiel sont réglementées par l’autorité ayant dans ses attributions le service des terres en question."
515,Art. 515 :,"Indépendamment des sanctions pénales, tout contrevenant peut-être condamné à la réparation des dommages soit par la remise en état des lieux perturbés de son fait, soit par le remboursement des dépenses sup- portées par la personne morale affectataire victime de ses agissements."
516,Art. 516 :,"Dans des conditions fixées par les autorités administratives compétentes, il peut être délivré des auto- risations spéciales conférant à des particuliers ou à des collectivités, le droit d’extraire des matériaux, d’établir des prises d’eau sur les dépendances du domaine public et d’exercer des droits de pêche ou de chasse. DE LA REPUBLIQUE TOGOLAISE 57 CHAPITRE II : DE LA GESTION ET DE LA PROTECTION DU DOMAINE PUBLIC IMMOBILIER DE L’ETAT ET DES COLLECTIVITES TERRITORIALES"
517,Art. 517 :,"Les biens immeubles du domaine public naturel et artificiel de l’Etat sont inaliénables, imprescriptibles et insaisissables."
518,Art. 518 :,"Les portions du domaine public reconnues sans intérêt pour les services publics ou l’intérêt général, peuvent être déclassées par décret en conseil des ministres et incorporées au domaine privé de l’Etat."
519,Art. 519 :,La sortie d’un bien immeuble du domaine public de l’Etat et des collectivités territoriales intervient dans les mêmes formes et procédures que leur délimitation ou leur classement.
520,Art. 520 :,"Le déclassement du domaine public de l’Etat est prononcé après enquête de commodo et incommodo, par arrêté du ministre chargé des domaines sur autorisation du conseil des ministres. Le déclassement du domaine public de la collectivité territoriale est prononcé après enquête de commodo et incommodo, par arrêté du maire sur avis favorable du conseil communal ou municipal. Les portions du domaine public déclassées sont incor- porées au domaine privé de l’Etat ou des collectivités territoriales et soumises aux conditions de gestion telles que prévues aux articles 541 à 551 du présent code."
521,Art. 521 :,Tout immeuble ou une portion d’immeuble du domaine public de l’Etat ou des collectivités territoriales déclassé ne peut faire l’objet de concession ou de cession à une personne privée que dans un but d’intérêt général.
522,Art. 522 :,"La gestion des portions du domaine public immo- bilier de l’Etat et de leurs dépendances relève du ministre chargé des affaires foncières, des ministres sectoriels ou des maires."
523,Art. 523 :,"L’Etat peut transférer, par décret en conseil des ministres, la gestion d’une partie de son domaine public immobilier à une collectivité territoriale qui en assure la conservation."
524,Art. 524 :,"Les personnes physiques et les personnes mo- rales de droit privé peuvent jouir du domaine public suivant les conditions spécifiques à chaque nature de bien, l’usage auquel ils sont destinés et, ce, dans les limites déterminées par voie réglementaire."
525,Art. 525 :,La gestion des terres et biens immeubles de la commune relève de la compétence du maire.
526,Art. 526 :,"Les terres et biens immeubles du domaine privé immobilier des collectivités territoriales peuvent être : 1- cédés à titre onéreux ou gratuit ou loués selon les règles du droit commun ; 2- affectés à une personne morale de droit public. Toutefois, la cession ou la location d’une terre ou d’un bien immeuble d’une commune doit être autorisée par délibération du conseil communal ou municipal. Il en est de même pour l’acceptation d’un don ou d’un legs."
527,Art. 527 :,Le bureau local du domaine et du foncier assiste le maire dans la gestion des terres et biens immeubles de la commune.
528,Art. 528 :,La gestion du domaine privé rural de la commune relève de la compétence du maire qui prend l’avis de la com- mission de gestion foncière territorialement compétente.
529,Art. 529 :,"Il est créé dans chaque commune, une commission de gestion foncière telle que prévue aux articles 29 à 31 du présent code. Elle a un rôle consultatif et assiste le maire dans la gestion des affaires foncières."
530,Art. 530 :,Les terres et biens immeubles visés à l’article 521 ci-dessus ne peuvent être cédés ou loués que sur délibération du conseil communal ou municipal en application de la loi portant organisation des communes en République togolaise. SOUS-TITRE II : DU DOMAINE PRIVE IMMOBILIER DE L’ETAT ET DES COLLECTIVITES TERRITORIALES CHAPITRE IER : DE LA CONSISTANCE ET DES MODES DE CONSTITUTION DU DOMAINE PRIVE IMMOBILIER DE L’ETAT ET DES COLLECTIVITES TERRITORIALES
